{"$defs":{"TargetWireV1":{"oneOf":[{"additionalProperties":false,"properties":{"event_id":{"type":"string"},"kind":{"const":"event","type":"string"}},"required":["kind","event_id"],"type":"object"},{"additionalProperties":false,"properties":{"block_id":{"type":"string"},"kind":{"const":"block","type":"string"}},"required":["kind","block_id"],"type":"object"}]}},"$id":"schemas/evidentrail/v1/evidence_reference.schema.json","$schema":"https://json-schema.org/draft/2020-12/schema","additionalProperties":false,"properties":{"allowed_relations":{"items":{"type":"string"},"maxItems":4096,"type":"array"},"contract":{"const":"evidentrail.evidence_reference","type":"string"},"contract_version":{"const":1,"format":"uint16","maximum":9007199254740991,"minimum":0,"type":"integer"},"evidence_reference_id":{"pattern":"^eref_[0-9a-f]{64}$","type":"string"},"expires_at_unix_nanos":{"pattern":"^-?(0|[1-9][0-9]*)$","type":"string"},"issued_at_unix_nanos":{"pattern":"^-?(0|[1-9][0-9]*)$","type":"string"},"result_id":{"pattern":"^result_[0-9a-f]{64}$","type":"string"},"targets":{"items":{"$ref":"#/$defs/TargetWireV1"},"maxItems":4096,"type":"array"}},"required":["contract","contract_version","evidence_reference_id","result_id","targets","allowed_relations","issued_at_unix_nanos","expires_at_unix_nanos"],"title":"evidentrail.evidence_reference","type":"object"}