{"allowed_relations":["exact"],"contract":"evidentrail.evidence_reference","contract_version":1,"evidence_reference_id":"eref_0000000000000000000000000000000000000000000000000000000000000000","expires_at_unix_nanos":"1","issued_at_unix_nanos":"0","result_id":"result_0000000000000000000000000000000000000000000000000000000000000000","targets":[{"event_id":"evt_0000000000000000000000000000000000000000000000000000000000000000","kind":"event"}]}